Date,Text,Retweets
2020-04-07 11:16:55+00:00,"GM foods ingested by insects eventually kill them, but there is a time lag. It takes approximately 12 days, in the case of the teeny tiny corn worm, for the modified mRNA to work its way into the DNA of the bug. 3/x ",17
2020-04-07 15:38:29+00:00,Exciting vaccine research for #SARSCoV2 is underway at Penn! Projects include DNA and mRNA vaccines. We are also developing a new test to measure how well vaccines stimulate antibody production @PaulFBates @TheWistar #COVID19 #coronavirus https://penntoday.upenn.edu/news/racing-deliver-vaccine-masses-coronavirus.,15
2020-04-07 16:20:05+00:00,"$MRNA A popular one this morning, seeing a poor low and it has to get into that excess. Profile structures can help in equity trading. Chart courtesy of @WindoTrader",12
2020-04-08 04:15:55+00:00,"Isn’t it interesting how Trump brags about how quickly this vaccine is being created and people still cheer him on? This vaccine uses mRNA, something they’ve never created to be used on humans before. It’s going to be catastrophic.",5
2020-04-08 05:44:59+00:00,"2024: I’m nervous as I prepare for an in studio show at the Amazon Radio One Music Broadcaster (Canadian Division, Quebec Arcology Site). My payment is 3 non refillable “junior employee class” syrettes of nCoV Vaccine mRNA-1273. I’m sweating. http://GlobalNews.ca is filming",7
2020-04-08 11:50:00+00:00,Yesterday's poll on mRNA vaccines. The fate of the world is on the line and biotwitter thinks it's a coin toss. ,9
2020-04-08 21:02:35+00:00,Article authored by a volunteer in the NIH phase I trial of Moderna’s mRNA-1273 vaccine against the SARS-CoV2 virus spike protein. ⁦@moderna_tx⁩ ⁦@FlagshipPioneer⁩,8
2020-04-09 13:00:00+00:00, $TRBO BARGAIN HERE-EXPECTING HUGE Float=76m Hot #COVID19 sector SS IS SUPER TIGHT CEO owns 257m common shares. #FeverDetectionCamera #coronavirus $IPIX $IFMK $NVAX $SRNE $APT $CBLI $AYTU $LAKE $GHSI $MRNA $SOLI $KNOS $PCTL $MARK $CYDY $PRED $CVSI $BIEI $IFRX $TCHEY,4
2020-04-09 14:18:36+00:00,Bill Gates global agenda is no secret in recent days he has made media circuits to promote his agenda He wants entire population vaccinated with a new mRNA-based COVID19 vaccine he wants lock downs to continue until this vaccine is developed https://healthimpactnews.com/2020/who-is-controlling-the-u-s-response-to-covid19-the-white-house-or-bill-gates/,14
2020-04-09 15:42:41+00:00,Much-hyped Moderna mRNA-1273 Covid-19 Vaccine Uses Aborted Fetal Cells ,31
2020-04-09 17:02:23+00:00,We are excited to have announced additional details on our collaboration with @pfizer to rapidly advance multiple mRNA-based COVID-19 vaccine candidates into clinical testing and ramp-up production capacities. https://bit.ly/39Vcn8B,61
2020-04-09 17:03:45+00:00,"The COVID-19 vaccine development landscape https://www.nature.com/articles/d41573-020-00073-5 As of April 8, 2020, there are 78 confirmed #COVID-19 vaccine candidates, 5 of which have already entered clinical trials. #ReseachMatters @HopeClinicEmory doing Phase I with mRNA vaccine @Moderna_txx has.",22
2020-04-10 19:47:10+00:00,GATA2 mRNA in urine extracellular vesicles predicts high risk #prostatecancer @KimmelCancerCtr @JEFFUrology published @JUrology. Great work by lab members J. Woo and @ssantasusagna and collaborators @urologiaPrats @AshTewariMD @LeonardGomella https://www.auajournals.org/doi/abs/10.1097/JU.0000000000001066,6
2020-04-10 20:46:21+00:00,"My research hasn't found a single successful vaccine for a mRNA Virus (Dengue, #SARSCoV 1.0, Common Colds [rhino &amp; corona kinds], nor Hepatitis C or West Nile. Vaccines for mRNA viruses was beyond the capability of science as of Jan2020. Good design for a bioweapon virus! ",15
2020-04-10 22:36:43+00:00,"I've enjoyed hearing Chris talk about this fascinating link between increased mRNA decay and transcription shutoff during apoptosis. Great to see a pre-print from @brittaspen lab with@EHartenian, who studies a similar effect from viral nucleases",3
2020-04-11 12:53:53+00:00,I honestly don't care if a billionaire or the $mrna team gets it don't first we should just be rooting for anyone trying to help us on accelerated timeframe. No hating on people trying to help so silly.,0
2020-04-11 20:21:51+00:00,Big Banks And Vaccine Players In The Spotlight $ABT $MRNA $REGN $GILD $TLSA $LLY $AMGN $SNY $PFE $NVAX https://seekingalpha.com/article/4337038,11
2020-04-12 01:51:29+00:00,Excited to share a new preprint from the lab by @pearl_ryder and @Junnan_Fang The coordinated localization of mRNA to centrosomes facilitates error-free mitosis https://www.biorxiv.org/content/10.1101/2020.04.09.034892v1 Easter bunny approved!,20
2020-04-12 10:00:00+00:00,"Amid the pandemic, scientists are racing to develop and test vaccines that can protect people from the coronavirus. One particularly swift effort involves a vaccine called mRNA-1273. ",26
2020-04-12 11:40:02+00:00,"He needs to be held 100% liable for this mrna vaccine which will be the most dangerous one yet, and that speaks volumes because the rest of the vaccine schedule has disabled 1 in 26 boys now with autism. Bill Gates of hell is behind the destruction of this country. #GatesifHell",25
2020-04-12 13:07:33+00:00," ""There are no approved mRNA or DNA vaccines, and neither has ever been tested in a large-scale clinical trial... “The COVID crisis is a great opportunity for those technologies to be pushed.” “It is like building an airplane while you are flying,” ",69
2020-04-12 18:58:05+00:00,"People like @KizzyPhD make this country great. She and her team &amp; co-inventors @McLellan_Lab developed a vaccine delivered by @moderna_tx mRNA. Phase 1 human trial began March 16, just 66 days after virus genome sequence released. She is a hero. Let's hope it works. ",3
2020-04-12 22:30:40+00:00,"Moderna the first company to reach a clinical trial for a #coronavirus vaccine, mRNA-1273 5 healthy adults, 2 shots, 28 days apart 3 different doses To determine if the #vaccine is safe and whether it stimulates the immune system @nytimes #covid_19",28
2020-04-13 07:20:42+00:00,I feel really bad for anyone that goes along with this. What he's telling you is not only are these unsafe and being fast tracked but. DNA / mRNA vaccines have never been used on humans. Guess what types of Vaccines Moderno and Inovio are producing? ,15
2020-04-13 15:19:34+00:00,5. This vaccine is going to be an mRNA-based vaccine which has never previously been in the market. It has the potential to alter human DNA. See: https://vaccineimpact.com/2020/will-a-covid19-vaccine-be-the-first-vaccine-to-alter-human-dna-to-further-advance-transhumanism/,42
2020-04-13 15:19:35+00:00,8. ....and will undoubtedly become the first mRNA-based vaccine to be tested in the U.S. and world population.,22
2020-04-13 15:19:37+00:00,"14. Bill Gates global agenda is no secret, and in recent days he has made the media circuits to promote his agenda. He wants the entire population vaccinated with a new mRNA-based COVID19 vaccine, and he wants the lock downs to continue until this vaccine is developed.",39
2020-04-13 18:33:51+00:00,"“I do believe that, technically speaking, the bottom is in.” #TheWatchList After telling @NPetallides why he believes the market saw its bottom last week, @sarge986 runs through his semiconductor &amp; healthcare stock picks: : $AMD, $NVDA, $MRVL : $GILD, $JNJ, $TDOC, $MRNA",9
2020-04-13 19:40:13+00:00,* #COVID2019 VACCINE * So i was thinking about for few days and i think we can make a vaccine by studying the Recovered Patients. As we know the Recovered Patients make Antibodies against #COVID2019 . Antibodies being protein must be translated from a mRNA. Which in turn is ,2
2020-04-14 07:30:00+00:00,#COVID19 Update: Pfizer Inc and @BioNTech_Group have entered into a global collaboration agreement to co-develop a mRNA-based coronavirus vaccine program aimed at preventing COVID-19 infection. Read more ,12
2020-04-14 11:53:57+00:00,"“The earliest we could have an approved vaccine … is in 2021,” says Moderna CEO Stephane Bancel. He says company is currently working with the authorities to find ways to help combat #coronavirus in 2020. #MRNA ",28
2020-04-14 14:54:31+00:00,Online Now: Transcription Dynamics Regulate Poly(A) Tails and Expression of the RNA Degradation Machinery to Balance mRNA Levels ,46
2020-04-14 19:00:00+00:00,"A study led by @junyue_cao, @JShendure &amp; @coletrapnell has found a new method for combined single-cell combinatorial indexing and messenger RNA labeling using combinatorial cell indexing and 4-thiouridine labeling of newly synthesized mRNA. Learn more: https://go.nature.com/2Vt9w1t",3
2020-04-15 01:58:47+00:00,$MRNA Nice looking long setup for tomorrow ,12
2020-04-15 11:22:10+00:00,"$MRNA Moderna Therapeutics on track to have #COVID19 vaccine ready ""by the Fall"" for Frontline health care workers under Emergency Use Authorization... and you better believe I'll be 1st in line with shirt sleeve rolled up!!! #SARSCoV2",43
2020-04-15 14:35:27+00:00,"Thank you @traderstewie for bringing $MRNA to attention, made out like a bandit. Wasn't watching until your post. Credit where credit is due #daytrading",1
2020-04-15 16:13:22+00:00,"A study of the unusual translation of a bicistronic mRNA that encodes MAVS and miniMAVS, known here as MAVS M1 and M2. ",16
2020-04-15 16:24:19+00:00,"Wow, a lengthy (for TV) interview with a true expert...and the timeline she suggests is amazing. I do hope this mRNA targeted strategy works... ",9
2020-04-15 18:09:41+00:00,$MRNA .... 10 cents away from hitting first target of $38! There's something especially satisfying about a trade that goes up over +9% on a big market down day! ,1
2020-04-15 18:12:47+00:00,"Unlikely voice of reason [To explain - when you know rushing a never-before-tested-on-humans mRNA vaccine into a market for billions of people, the potential for disaster is enormous. Distancing from that now is advisable to avoid being accused of being complicit later ] ",24
2020-04-15 18:29:05+00:00,"@traderstewie I have a super small account, but thanks to your MRNA, ATVI, ZUO, APT, and LAKE tips I'm up 20% today.",1
2020-04-15 19:27:21+00:00,"A safe & effective coronavirus vaccine will not be produced in our lifetimes. Experiments with SARS & MERS vaccines were a disaster that left people MORE vulnerable to the virus. Even Hotez admits this. mRNA vaccines are a dead end, non-starter, criminal waste of resources.",304
2020-04-15 22:17:29+00:00,Stocks Making New Highs $PSTI Pluristem $MRNA Moderna $NFLX Netflix $ATVI Activision $JD JD .com Relative Strength $ABT Abbott $TW Trade Web $BABA Ali Baba $REYN Reynolds Consumer Products Strong Afternoon MACD Crossover $BA Boeing,5
2020-04-16 02:05:59+00:00,"$SPY $DJIA $QQQ I'm seeing more and more individual stocks performing exceptionally well, even while indexes are red like today. $AMZN $PTON $NFLX $CHWY $LVGO $MRNA $AMED $DOCU $TDOC $DXCM $ZM $SHOP and more!",4
2020-04-16 14:32:53+00:00,$MRNA hit my 1st target of $38... closed the remaining position and booked my gains. Just a heads up! Feel free to ride it to $40(secondary target if you want!).... all you from here but thanks for the fun ride $MRNA! We will meet again later! ,0
2020-04-16 15:28:16+00:00,"I was super excited to join @VirusesImmunity and @RDasLab for this video by @novapbs, talking about #SARSCoV2 #HCoV19 #COVID19 #coronavirus mRNA vaccines! I particularly loved Dr. Das's description of RNA as the Snapchat messages of molecular biology. ",26
2020-04-16 16:59:58+00:00,"Vaccines are crucial to ending the pandemic by creating widespread immunity to the virus. There are currently 70 #COVID19 vaccines in development, according to the @WHO. Treatments like mRNA-1273 take longer to develop, because they must be proven to be safe for healthy people ",8
2020-04-16 18:25:33+00:00,"Next week is #KnowYourEnemy 5! I've volunteered to try to make some sense of the vaccine landscape for #COVID19 with a particular focus on mRNA vaccines: how they work, and what the preclinical data looks like for vaccine candidates from a different respiratory infection (RSV). ",7
2020-04-16 18:27:44+00:00,"New Feature: You can now make groups in the Study View using continuous molecular profiles of one or more genes, such as mRNA expression, methylation, RPPA and continuous CNA. Example of high ERBB2 expression in breast cancer used in group comparison: https://bit.ly/34yVm30",9
2020-04-16 19:59:49+00:00,"Transcription Dynamics Regulate m6A, Poly(A) Tails and Expression of the RNA Degradation Machinery to Balance mRNA Levels ",3
2020-04-16 22:01:10+00:00,We just announced an award from U.S. government agency @BARDA for up to $483 million to accelerate development of our mRNA vaccine (mRNA-1273) against novel coronavirus https://buff.ly/3eqHV9L,90
2020-04-16 22:06:32+00:00,"We are thankful for the support of @BARDA and @RickABright to fund the accelerated development of mRNA-1273, our vaccine candidate against SARS-CoV-2 https://buff.ly/3eqHV9L",37
2020-04-16 22:57:41+00:00,Moderna +10.5% after-hours on news it will receive up to $483M from the U.S. government to accelerate development of a #COVID19 vaccine. $MRNA ,15
2020-04-16 23:07:33+00:00,"$MRNA +20% AH on 500M federal grant to speed vaccine dev. Lots of good news today on COVID19 front. Gotta love the random doomers in my feed skeptical about today's progress (Gilead &amp; Moderna are proper life science adults in the room, they have no idea). ",10
2020-04-16 23:14:05+00:00,"$MRNA ""That was good enough for a 21% spike in the share price on Thursday evening, worth more than $2.6 billion in market cap as the company's valuation surged past the $15 billion mark.""' https://endpts.com/breaking-barda-bets-483m-on-modernas-covid-19-vaccine-as-the-biotech-plots-ultra-fast-phiii-recruiting-150-staffers-to-scale-up-24-7/",10
2020-04-16 23:15:06+00:00,Biotech updates 04/16: $GILD promising #COVID19 response - report +15% AH $RCUS +89% $MREO +36% sympathy move $MRNA COVID funding + timeline update $PULM offering -21% $REGN Ebola PDUFA Oct 25 Pipeline updates $AFMD $ATNM $EARS $MGTA $PDSB $PRVB $SLS,5
2020-04-17 00:41:45+00:00,"Good Evening! $SPX $2882 hits in AHs, $2934 next then we can stall (pullback if needed), $3000 / under $2750 bad $TSLA $767, $800, $807-813, $835 / under $700 bad $NVDA $305, $316 comes / under $292 bad "" $SPX $ES $SPY $ROKU $AMZN $AAPL $NVDA $LRCX $GILD $MRNA $REGN """,6
2020-04-17 04:24:57+00:00,COMMENT what is the best end of the week position? $SPY $SRNE $ATHX $AMRN $PENN $MFA $DHT $INO $EAT $NXE $OPK $LK $CCL $SPCE $OXY $WDFC $NCLH $RCL $MRNA $CVE $AAL $ZM $TWTR $TSLA $CHWY $WYNN $BA $DOCU $SQ $DAL $AYTU $NEPT $BMRA $TTOO $BTC $TSLA,6
2020-04-17 04:36:43+00:00,"Here's a list of stocks in our universe that are trading at 8-Week relative highs. If you think the broad markets continue higher in the coming days/weeks, these could be worth considering. $IPHI $FIVN $CATS $AMZN $AMT $SHOP $SGEN $OSUR $MRNA $LVGO $LLNW $HUM $ETSY $EA $BILI",8
2020-04-17 09:26:16+00:00,Another boring quarantine day? Want to know more about how to combine superresolution microscopy with sophisticated data analysis to study kinesin-APC-mRNA movement and complex formation? Check out our latest paper in ScienceAdvances @SebasBaumann et al. @CRGenomica @ICFOnians,2
2020-04-17 11:42:43+00:00,"Futures Pop, Gilead's Covid-19 Treatment, Trading My 'Virus Group' $KSU $SLB $STT $MRNA $GILD $BA $JNJ $SPX $COMP https://realmoney.thestreet.com/investing/stocks/futures-pop-gileads-covid-19-treatment-trading-virus-group--15295740 via @RealMoney",5
2020-04-17 12:56:10+00:00, Upside down day with prior winners being today's losers and vice versa. 9 at 9™ – 04/17/20 https://www.marketscholars.com/2020/04/17/9-at-9-04-17-20/ via @market_scholars #9at9 #premarket #FridayFeeling $LYV $MRNA $PLNT $SPR $GILD $BA $SPG $MGM $RCL $TDOC $ROKU $ATVI $CTXS $NFLX $NEM $AMZN $DOCU $TTWO,14
2020-04-17 12:57:14+00:00,"Oxford vaccine trial has completed recruitment of 500 patients so well ahead of $MRNA and other players like Cansino, $JNJ. Primary endpoint is efficacy",13
2020-04-17 14:10:15+00:00,@timothysykes bought 100 shares of $MRNA at 35 on 4/15 sold most at 48 for a nice $1200 profit on tiny size!,2
2020-04-17 15:15:16+00:00,@traderstewie climbed out of a 2 year hole from some bonehead plays with the #MRNA and #CODX plays. Thanks for helping me understand charts I'm learning by the day. Much appreciated!,1
2020-04-17 17:11:00+00:00,That's what I was doing all day yesterday pretty much.... Took profits in several trades shared with the FinTwit community! $CODX $ATVI $MRNA $WORX Never be scared to click that SELL button at risk of missing out on more gains! Profits aren't gains until they're booked!,4
2020-04-17 21:39:25+00:00,"Some stocks hitting yearly highs within the last 5 trading days. IF we bottomed last month, these could be the leaders going forward: $GOLD $ZTO $AMZN $DG $WMT $GIS $ABT $DXCM $MASI $VEEV $MRNA $REGN $LLY $BIO $MKTX $AKAM $OKTA $CTXS $DOCU $QLYS $NFLX $ATVI $EA $NTES $EQIX $SBAC",9
2020-04-18 04:06:02+00:00,Corona Stocks: Work from home: $ZM $TEAM $MSFT $DOCU Social Distancing: $NFLX $AMZN $DPZ $JD $BABA Healthcare &amp; Biotech: $TDOC $GILD $REGN $MRNA,15
2020-04-18 10:25:02+00:00,#AVCT Moderna approached Avacta about the possibility of using the Affimer technology in its various messenger RNA (‘mRNA’) workstreams (part 1) 2015 ,7
2020-04-18 16:11:16+00:00,"If you are, like everyone else, anxiously awaiting a mass produced, affordable, vaccine for Corona, keep a close eye on the news coming out of a company called Moderna Therapeutics. Their mRNA based vaccine could hold the key ....",58
2020-04-18 20:44:07+00:00,"#COVID19 candidate #vaccines in clinical evaluation: Ad5-nCoV (Phase 2), mRNA-1273 (Phase 1), INO-4800 (Phase 1) [Sources: Thanh Le T et al. Nat Rev Drug Discov. 2020; Draft landscape WHO 11 April 2020: http://who.int]",11
2020-04-18 23:05:26+00:00,"Check out our preprint on the type I-D #CRISPR-Cas complex. It has an unexpected small subunit expressed from an alternative translational start within the large subunit mRNA! And small subunit translation from large subunit genes is widespread in type I-B, I-C &amp; I-D systems! https://twitter.com/RobFagerlund/status/1251631243453542400",19
2020-04-18 23:48:30+00:00,Interesting work showing that excessive microglial (but not neuronal) translation of mRNA to protein leads to sex-specific autistic behavioral phenotypes. https://www.nature.com/articles/s41467-020-15530-3.pdf,9
2020-04-19 05:32:17+00:00,Our new results: Extending the spacing between the Shine-Dalgarno sequence and P-site codon reduces the rate of mRNA translocation ,4
2020-04-19 13:32:56+00:00,JUMPS IN #NASDAQ SHORTS: $TLRY $LYFT $MU $TSLA $MSFT $Z $MIDD $EXPE $EXEL $MEET $MRNA $MAR $IMMU $GBT $CAR $ALKS $NVDA $FTNT $PLAY $ADVM $CAKE $UAL $WYNN $CGNX $INCY $PBYI,18
2020-04-19 15:09:46+00:00,"$MRNA perception meet reality: They had an early prospect ready for clinical trials just 42 days after the COVID19 genetic sequence was released. But the biotech underlying this drug has existed for nearly 30 years, + it has never yielded a working vaccine for any human disease. ",4
2020-04-19 18:36:37+00:00,#TickerMonkey UWL All the same names in play : AMZN NFLX TSLA MSFT VRTX AMD SHOP DXCM ZM WORK LVGO DOCU TDOC PTON MRNA ROKU NET CRWD ZS BABA ACAD VEEV AMT CHWY NOW FTNT RNG AYX GILD COUP TEAM SQ PYPL STAA SPCE PODD VIPS ETSY OKTA IPHI SDGR SE VTIQ,7
2020-04-19 18:52:16+00:00,Our perspective on mRNA therapies against melanoma is now available @BiochemistryACS. https://pubs.acs.org/doi/abs/10.1021/acs.biochem.0c00181,9
2020-04-20 05:05:56+00:00,It will also be the FIRST mRNA vaccine! There is no other mRNA vax,5
2020-04-20 13:11:54+00:00,"Finding the right #vaccine is central to fighting #COVID19. With 54 vaccines under development, it's time to learn more about mRNA vaccines. #EUfunded researchers reveal 5 things you need to know: https://horizon-magazine.eu/article/five-things-you-need-know-about-mrna-vaccines.html #coronavirus #EUHealthResearch #ResearchImpactEU",39
2020-04-20 13:51:29+00:00,$MRNA setting up to be an A+ opportunity Shorts keep trying to find top. I'll wait.,2
2020-04-20 14:06:23+00:00,"CPI is joining the national taskforce to identify and develop a #COVID19 vaccine. Using our extensive expertise we'll play a key role, focusing on the development, scale-up, manufacture &amp; supply of @imperialcollege’s mRNA #vaccine candidate: https://hubs.ly/H0pFVDK0 #fightcovid",6
2020-04-20 14:24:04+00:00,What are mRNA vaccines and could they provide a breakthrough in the fight against covid-19? Find out more on our “Babbage” podcast https://econ.trib.al/XuZidSN,21
2020-04-20 14:34:14+00:00,$MRNA run feels excessive here. Reminds me of $BLUE a few years back or all the CRISPR stocks for awhile. They should do a huge raise here while they can why not.,2
2020-04-20 14:41:30+00:00,$MRNA and $NVAX my 2 big picks for the #COVIDー19 vaccine are trending high. Looks like we might hear soon successful completion of Phase 1 trials for the vaccine!,1
2020-04-20 15:12:00+00:00,"Amazing what sentiment can do, both ways... $ALXN a bit over a month ago was worth under $17B at one point $MRNA is worth $17B today",2
2020-04-20 16:02:26+00:00,What can full-length mRNA sequencing reveal about single cell gene expression? PacBio principal scientist @JG_Underwood will explain it all in a streamed presentation tomorrow on opening day of #LRGenetics http://ow.ly/TqOR50zbXMn #IsoSeq,4
2020-04-20 16:57:00+00:00,"Check out $CTYX! PR specifying deals is coming soon - company became pink current one week ago - no debt, no dilution, no R/S! #OTC #Pink #NASDAQ #NYSE #CNBC #Finance $BA $AAPL $AMZN $SIRI $WKHS $ALPP $CHFS $CODX $COST $HD $PEP $BRK $DECN $JNJ $LIN $MRNA $TSLA $TTOO $BYND $CHWY",7
2020-04-20 18:36:57+00:00,Wish me luck - just shorted $MRNA @$53+. Last time short was $CNST for literally a few days last December (from $51 to $36). Doubt I've ever shorted successfully twice in a row!,1
2020-04-20 21:26:02+00:00,"EXCELLENT overview of the whole coronavirus vaccine issue, and simple to understand even if you’re not a virologist. To me, the DNA or mRNA approach - if proven safe- seems most promising: ",7
2020-04-20 22:32:27+00:00,The Explosive Second Day Play (trading strategy) $MRNA ,4
2020-04-21 01:56:33+00:00,Tuesday’s 1: $AAPL $AMD $AMZN $FB $BABA $GOOGL $MSFT $NFLX $BA $ADBE $CRM $CMG $INTC $MU $BYND $MA $IBM $CGC $CRON $BMY $CRWD $DEAC $KO $LMT $MDB $MRNA $MRVL ,3
2020-04-21 05:18:43+00:00,This is a pretty good basic summary of the pluses and minuses of mRNA vaccines. ,13
2020-04-21 08:23:45+00:00,Experts from @ukCPI join the national drive to identify and produce effective #vaccines for #COVID19. Supporting efforts to manufacture &amp; formulate novel mRNA vaccine candidates using skills in biologic pharmaceuticals &amp; #medicines #manufacturing https://hvm.catapult.org.uk/news/cpi-joins-national-taskforce-to-develop-covid-19-vaccine/,4
2020-04-21 14:18:42+00:00,"Back of the envelope thinking : If $ARCT were to catch up to $MRNA Market Cap, ARCT share price would have to reach $900/SH Alot of room to run for ARCT",3
2020-04-21 15:41:10+00:00,Thank you $MRNA. That was beautiful. ,2
2020-04-21 17:35:13+00:00,"Senior Elise Tong's scientific research has been accepted for publication in The Journal of Neuroscience. Elise is listed as a contributing author for the work she did @EmoryUniversity with Dr. Manuel Yepes on mRNA, gel electrophoresis, and more. Congrats! https://www.woodward.edu/news/p/~board/news/post/senior-published-for-scientific-research",8
2020-04-21 20:01:13+00:00,"Gave back a third of my gains on the day, meaning I am finishing the day with the second biggest day ever after yesterday Plan for the afternoon was a $SPY nlod and trading $SHOP and $MRNA for continuation based off of it Made a sizing mistake on $WATT.(overestimated liquidity)",1
2020-04-21 20:10:32+00:00,I genuinely hope the ideas today helped out Just a small taste of what IU community is all about Some seriously good warnings and ideas today: $WATT $TRMD $SHOP $MRNA $NVAX etc. A+ opps If you have any questions about the room reach out - can connect you ,3
2020-04-21 20:14:26+00:00,"Solid day today, more great opportunities. Just wish I had used bigger size. But thats always the case right... $MRNA was the winner today, been waiting on this fade. $WATT was a headache, got stopped out a few times on it, gave up.",2
2020-04-21 22:43:04+00:00,"P/L: Was in the #FiveFigureClub but lost the invite on a failed scalp on $MRNA in the afternoon but all good. A tricky day but still money. $WATT Nice washout long. $VXRT $PECK with both headaches. $MRNA was great on the dump and bounces. Keep it coming, Mr. Market! ",0
2020-04-22 01:34:01+00:00,#GeneExpression_Dynamics in Single Cells | labeling newly synthesized mRNA #SciFate | Jay Shendure @UW @NatureBiotech https://www.nature.com/articles/s41587-020-0480-9,3
2020-04-22 02:43:40+00:00,[FREE VIDEO] Making $80/Share in 1 Hour Trading Shopify (Always Look Left ) $SHOP $MRNA $NVAX $VXRT Trade Recap Enjoy !,9
2020-04-22 07:24:04+00:00,What are mRNA vaccines and could they provide a breakthrough in the fight against covid-19? Find out more on our “Babbage” podcast https://econ.trib.al/iGa3Lkq,21
2020-04-22 08:34:22+00:00,"Cards on the table: none of this makes sense to me. Pence, Baron and Jared are on this? We have Omarosa figuring out just what this mRNA is, with Susan at YouTube making sure no one blames China? Are we endangering our doctors &amp; nurses sufficiently by holding back enough PPE? ",134
2020-04-22 09:45:03+00:00,CPI doing an awesome job leading the workstream in the BioIndustry Association #COVID19 Vaccine Manufacturing Taskforce that is supporting the work of Robin Shattock's team at Imperial College London developing an mRNA #vaccine ,3
