Date,Text,Retweets
2020-04-22 18:06:04+00:00,"$MRNA Harvard Professor Reaps 17,000% Return on Early Moderna Bet https://www.bloomberg.com/news/articles/2020-04-22/harvard-professor-notches-17-000-return-on-early-moderna-wager",5
2020-04-22 19:04:57+00:00,"$BNTX vs $MRNA if I had to pick 1 of them for covid19 mRNA vaccine, it would be $BNTX: FOUR differentiated vaccine formats vs 1 standard one. No time to lose, strong alliances. LIGHTSPEED!",5
2020-04-23 12:11:06+00:00,"A feel good #COVID19 story: 17,000% return for @timothyspringer on $5M seed in $MRNA in 2010 Most of winnings will go to @IPI_Protein Other co's w his golden touch: • Leukosite (acq by Millenium / $TAK $100M) • $MORF (IPO 2019) • $SRRK (IPO 2018) https://endpts.com/covid-19-roundup-volunteers-in-nih-trial-get-second-shot-of-modernas-vaccine/",3
2020-04-23 12:25:23+00:00,"Exciting news from Germany! BioNTech gets the green light to begin clinical trials for its mRNA COVID-19 vaccine. Keep positive and stay alert, we shall defeat the pandemic together! ",17
2020-04-23 14:45:26+00:00,Impressive trade.... and congratulations! This $INO setup even outperformed the previous $CODX and $MRNA setups! ... much to my surprise! ,0
2020-04-23 17:39:44+00:00,"15 things wrong with the heavily biased, purposely distorting @WhiteResearch @shiningboy $BSGM hit piece....published on their website since Seeking Alpha (low bar) rejected the rag. See #15 on their last ""#COVID19 short"" $CODX up 500% https://www.investorvillage.com/groups.asp?mb=19723&amp;mn=676&amp;pt=msg&amp;mid=20605030 $GILD $VIR $MRNA",9
2020-04-23 18:19:47+00:00,Gopal Kushawah of the @BazziniLab at Stowers in collaboration with @CRISPRSCAN achieved mRNA knockdown in embryos using CRISPR-Cas13d. #TAGC20 #Zfish20,3
2020-04-23 18:24:01+00:00,Great talk @gopalkushawah #TAGC20 #Zfish20 CRISPR-Cas13 targeting mRNA in vertebrates embryos. Great collaboration with @crisprscan @ScienceStowers,8
2020-04-23 19:26:08+00:00," German BionTech just got gov. approval for a clinical virus phase 1+2 combi vac study as preclinic was promising. It’s called BNT162, a brandnew approach with mRNA and we call it „lightspeed“. 200 volonteers, 400 researchers working 24/7",8
2020-04-23 22:41:17+00:00,Scientists openly admit that mRNA vaccines have potential to cause pathological thrombus formation from extracellular RNA. Would you risk heart attacks and strokes for a Coronavirus vaccine? ,138
2020-04-23 22:47:38+00:00,"The zeal with which @TheDemocrats have attacked chloroquine, a product that has been on the market for 70 years, while defending a type of vaccine (mRNA) that has NEVER been shown to work in humans, is mind boggling.",231
2020-04-24 09:54:17+00:00,"Six Coronavirus Vaccines Under Clinical Trials, WHO Says $INO $MRNA",4
2020-04-24 11:14:42+00:00,"“Now, just 6 weeks on, Oxford have begun human trials of their ChAdOx1 nCoV-19 vaccine candidate. The Oxford vaccine will be the third CEPI-funded vaccine to enter into phase 1 trials, along with Inovio’s INO-4800 DNA vaccine candidate and Moderna’s mRNA-1273 candidate.” ",5
2020-04-24 12:39:44+00:00,"Harvard Professor Reaps 17,000% Return on Early $MRNA Bet. $5M investment is now worth more than $800 million. ",8
2020-04-24 17:25:16+00:00,Really cool mechanistic story from ⁦@Angela_Ting_PhD⁩ ⁦@CCLRI⁩ in ⁦@MolecularCell⁩ showing how DNA methylation regulates mRNA alternative cleavage and polyadenylation! Congratulations! ⁦@CleClinic_GUMRC⁩ ⁦@CleClinicMD⁩,6
2020-04-24 17:51:03+00:00,Amazing opportunity to work on mRNA therapies using #compchem!,9
2020-04-24 21:38:39+00:00,"#COVID19 candidate #vaccines in clinical evaluation at 20 April 2020: PiCoVacc (Phase 1), Ad5-nCoV (Phase 2), mRNA-1273 (Phase 1), INO-4800 (Phase 1) [Sources: Thanh Le T et al. Nat Rev Drug Discov. 2020; Gao Q et al. bioRxiv, 2020; Draft landscape WHO 20 April 2020] ",10
2020-04-25 03:11:18+00:00,Great to see our latest work on chemokine inhibiting sulfated #CyclicPeptides discovered through RaPID mRNA display published in @J_A_C_S today! Check it out at the link: https://pubs.acs.org/doi/pdf/10.1021/jacs.0c03152,7
2020-04-25 11:29:31+00:00,This is an interesting paper on treating #flu or #COVID19 by mRNA targeting approach -&gt; in-vitro and in-vivo delivery of #CRISPR Cas13a mRNA to knockdown conserved regions of H1N1 influenza or #SARSCoV2. I will comment a bit on the paper https://www.biorxiv.org/content/10.1101/2020.04.24.060418v1,20
2020-04-25 14:53:49+00:00,Yeah that would be too convenient. Isn't that the whole point of the science behind the mRNA vaccines being developed??? https://twitter.com/WHO/status/1253995619921821698?s=19,7
2020-04-27 11:00:24+00:00,This #COVID19 paper on detection of #SARSCoV2 mRNA in air says -High concentration of virus in crowded public areas (toilets) - - virus in &lt; 2.5 µm aerosols =&gt; long suspension - Deposition on floor from protective equipment &amp; potentially transmissible https://www.nature.com/articles/s41586-020-2271-3,12
2020-04-27 14:54:32+00:00,Online Now: BR-Bodies Provide Selectively Permeable Condensates that Stimulate mRNA Decay and Prevent Release of Decay Intermediates ,11
2020-04-27 16:20:36+00:00,All #metastatic patients are eligible for this phase 1 trial testing mRNA-2416 alone &amp; in combo with durvalumab; Only ovarian cancer patients are eligible for phase 2 #BCSM #GyncSM #AACR20 https://clinicaltrials.gov/ct2/show/NCT03323398,4
2020-04-27 20:35:09+00:00,We just announced that we have submitted an IND application to the U.S. FDA for a Phase 2 study of our mRNA Vaccine (mRNA-1273) against novel coronavirus. Read more: https://buff.ly/3aIW7rq,164
2020-04-28 14:05:19+00:00,"For more on RNA-related therapies, here are articles on: RNA-based approaches to cancer immunotherapy https://rdcu.be/b3P65 mRNA vaccines https://rdcu.be/b3P68 Small molecules targeting RNA https://rdcu.be/b3P7b siRNA therapeutics https://rdcu.be/b3P7e",33
2020-04-28 18:11:50+00:00,"Pfizer CEO plans to have millions of vaccine doses THIS year, IF it works, I bet it DOES work along with Moderna/NIH’s vaccine too. MRNA should be ‘first to market in US’ but might not have the manufacturing capacities like Pfizer. Doesn’t matter though since we all will benefit ",3
2020-04-28 18:13:12+00:00,when the 3rd base in your mRNA codon is wrong but you still get the right amino acid ,20
2020-04-28 19:00:27+00:00,Inovio Option Trader Bets $100K That Coronavirus Vaccine Stock Will Double Again By August $INO $MRNA ,6
2020-04-28 20:20:08+00:00,"And serum institute of India is ramping up to go into production in September with this vaccine. Pls God, let the vaccine be efficient. Oxford Researchers Say Their COVID-19 Vaccine Could Be Available in September @themotleyfool #stocks $JNJ $MRNA ",2
2020-04-28 20:31:47+00:00,This made me laugh... $INO $MRNA $GILD,10
2020-04-29 01:48:15+00:00,"It turns out mRNA vaccine design (arguably the most promising direction to combat #COVID19) can be reduced to context-free grammar intersecting with a DFA, just like parsing lattice! Fascinating connection between computational linguistics and biology: https://arxiv.org/abs/2004.10177",25
2020-04-29 12:06:46+00:00,"Earnings in Full Swing, Workplace Evolution, Fed Day $TSN $FDX $TGT $WMT $AMZN $PFE $MRNA $JNJ $AMT $ANTM $AZN $ADP $BA $CCL $GD $GE $HUM $MA $NSC $NOC $RCL $SHW $SPOT $YUM $EBAY $FB $MSFT $QCOM $NOW $TDOC $TSLA $URI $VRTX $SPX $COMP https://realmoney.thestreet.com/investing/stocks/earnings-in-full-swing-workplace-evolution-fed-day-15306688 via @RealMoney",5
2020-04-29 18:49:27+00:00,Meet two scientists from our lab behind the development of a coronavirus (SARS-CoV-2) nanoparticle vaccine. Also highlighted: @ichaydon for his involvement as a volunteer in the ongoing @moderna_tx coronavirus mRNA vaccine clinical trial. ,11
2020-04-29 19:31:25+00:00,"Every single vaccine candidate being looked at for #COVID19 will genetically modify the host, whether it is mRNA, DNA, or viral vector. The company that got the US contract? Johnson and Johnson... ",49
2020-04-29 20:21:53+00:00,"BMO inits $MRNA with 28B mkt cap tgt 'Whether its lead candidate mRNA-1273 will provide protective immunity against SARS-CoV-2 is ""far from certain,"" but securing $483M from BARDA and ""promising results"" with later-stage vaccine candidates ""validate platform potential' ",2
2020-04-29 21:02:07+00:00,A great day in the market! Unless you happened to be a #COVID19 stock. Interesting rotation continues. Will be curious to see if some of these stocks that are still above their 30 day moving averages can find a bounce. $ZM $TDOC $CLX $SJM $WMT $KR $DG $PEP $APT $LAKE $MRNA $REGN,9
2020-04-29 21:47:53+00:00,"About 10% of Russell 1,000 stocks are now up since the 2/19 all-time high. These are the 35 up the most. Includes $MRNA $W $GILD $NEM $MKTX $DPZ $ETSY $DOCU $GIS",8
2020-04-30 00:04:36+00:00,Thoughts? #COVID19 #coronavirus #Qanon $MRNA $GILD $JNJ $PFE,9
2020-04-30 13:36:43+00:00,"I continue to believe we will have better disease management in the fall, possible antibody treatment and prophylaxis, possible partially effective mRNA vaccine, and visibility into conventional vaccine scale in winter, then light at end of tunnel.",7
2020-04-30 13:55:16+00:00,". @HVM_Catapult centre, @ukCPI are playing a role in the #Governments Taskforce Response for the development, trialling, testing &amp; manufacture of a #COVID19 #vaccine They will focus on development, scale-up &amp; supply of the #mRNA vaccine candidate http://ow.ly/kLuv50zjT6K",5
2020-05-01 11:21:12+00:00,"“What Lonza provides us is a 10x scale-up from Norwood alone,” $MRNA #C19 (let's go with a new hashtag, please -- Americans traditionally abbreviate everything)",3
2020-05-01 11:29:26+00:00,"Moderna announces an alliance to begin large-scale manufacturing of its #covid19 vaccine candidate — aiming for 1B doses a year, with the first batches in July. $MRNA ",3
2020-05-01 11:51:56+00:00,Moderna aims to produce 1B doses per year of its potential vaccine for #COVID19 after announcing a partnership with Lonza. $MRNA CEO Stephane Bancel on the logistical challenges of manufacturing in such huge numbers: ,10
2020-05-01 13:05:53+00:00,Moderna scaling up towards making 1 billion doses per year of its experimental mRNA vaccine for covid-19 with funding from BARDA. (1/2) ,11
2020-05-01 13:08:50+00:00,"With Moderna and Lonza announcing plans to scale up to potentially 1 billion doses per year of Moderna's coronavirus vaccine, a good time to reread @RLCscienceboss's story on mRNA vaccines in Covid-19: ",12
2020-05-01 17:16:30+00:00,"CNN threw everything it found on $MRNA into this stew --the qs, the anonymous gripes, the risks of a snap trial program sans animal data, etc and it all boiled down to what we knew: It's promising tech that might not be the fast fix we need. Let's see. ",16
2020-05-01 20:44:48+00:00,"The research team is expected to publish the mRNA sequence, allowing others to create the so-called “primer” required. Scientists are the best!",2
2020-05-02 11:28:45+00:00,"#Woke up to this gem. I mean if this doesn’t blow your mind, what will. THIS ISNT ABOUT #HEALTH AT ALL. This is to make us sicker, not only now, but future generations. Essentially making us #GMO, #transhumans, w/ our #genes edited forever. #RNA #MRNA #blanketimmunity #WAKEUP",38
2020-05-02 12:58:00+00:00,#earnings for the week http://eps.sh/cal $SHOP $ROKU $DIS $TSN $CVS $BYND $PYPL $SQ $ATVI $W $UBER $SRC $PINS $MRNA $REGN $L $JBLU $GOLD $ENPH $SWKS $SPCE $RACE $TTD $WAB $GM $PTON $ALK $ZNGA $TEVA $SYY $OXY $WYNN $NEM $PLUG $TWLO $TREE $LYFT $TMUS $WING $INSG $CHGG,497
2020-05-02 14:10:25+00:00,"NIH Do you know? Educate yourself. Within two weeks of the discovery of COVID-19, NIAID researchers had determined how the virus enters cells. And within two months sites had begun Phase 1 trials of a treatment (remdesivir) and a vaccine (mRNA-1273). https://www.niaid.nih.gov/diseases-conditions/coronaviruses",5
2020-05-02 18:58:50+00:00,Great summary @BioCentury! #COVID19 vaccines in development. $MRNA $BNTX $PFE $INO $NVAX $JNJ $GSK #Sinovac #CanSinoBiologics https://www.biocentury.com/article/305091,5
2020-05-02 20:01:28+00:00,Highly parallel and efficient single cell mRNA sequencing with paired picoliter chambers https://www.nature.com/articles/s41467-020-15765-0#MOESM1,14
2020-05-02 21:10:12+00:00,"For those of us developing oligonucleotide therapeutics, we are very glad that Chinese authorities shared the SARS-CoV-2 genome with the world on January 11. Immediately oligonucleotide therapeutics (including mRNA vaccines) were designed based on that sequence. @OTSociety",10
2020-05-03 12:01:21+00:00, Notable #Earnings To Watch This Week (via @eWhispers) Mon: $SHAK $TSN $SWKS $RACE Tues: $DIS $BYND $PINS $SPCE $ATVI $EA $W $REGN Wed: $SHOP $PYPL $SQ $LYFT $PTON $CVS $GM $GOLD $WING $TWLO $ETSY Thurs: $ROKU $UBER $MRNA $VIAC $JBLU $TTD $BKNG Fri: $CRON $DIA $SPY $QQQ,40
2020-05-03 15:00:54+00:00,"I have little basis,I hate to take things Proactively and Speak only with your own Feelings I'd like you to explain the “mRNA protease reverse transcriptase“ and the “antigen-antibody specific reaction of immunity“ . It's very important of basic . ",17
2020-05-03 15:03:35+00:00,Well there are no mRNA vaccines out there to provide safety data. Comparisons It’s a theoretical. Protein antigen based approaches have been with us since the 19th century and Dr. Edward Jenner with cowpox/smallpox ,4
2020-05-03 16:01:31+00:00,"Associate Principal Scientist: #merckchemistry is seeking an exceptional individual to join the mRNA Display Peptide Discovery group in Kenilworth, NJ. #chemjobs",11
2020-05-03 18:32:00+00:00,Big week of calls coming up. M: $EPZM $KURA T: $CLVS $INCY $IOVA $REGN W: $ALXN $ALNY $SRPT T: $ACAD $BMY $MRNA F: $GLPG $MRSN $YMAB Full schedule: https://www.loncarblog.com/may-4-earnings,13
2020-05-03 19:00:03+00:00,"Of the 72 vaccines currently in trials in America, I would say Moderna has the lead. Vaccine trials are going well, & Moderna has said they will give advanced update by late May. A successful vaccine could be fast-tracked much quicker than people expect. $SPY $MRNA $QQQ $FB",4
2020-05-03 22:13:53+00:00,DNA & mRNA vaccines are two types that can be scaled up quickly in the worldwide race to produce a #COVID19 vaccine. The chart is a primer on nucleic acid - DNA and mRNA - COVID19 vaccines. Click/tap to enlarge chart. Source: journal Nature ,18
2020-05-04 12:43:40+00:00,$ARCT and $CTLT Announce Partnership to Manufacture mRNA-Based #COVID19 Vaccine.,8
2020-05-04 15:55:18+00:00,"ICYMI (I did)- stunning @yamashitaflylab preprint- localized #dynein transcripts at fly #cilia, dep. on Reptin &amp; Pontin, aka assembly factors! Plot thickens- Localized mRNA translation mediates maturation of cytoplasmic cilia in Drosophila spermatogenesis https://www.biorxiv.org/content/10.1101/2020.04.21.054247v1 pic.twitter.com/b5SqXIIyP8",4
2020-05-04 16:16:44+00:00,"Cellular #nanoporation for scalable #EV production and #mRNA loading? Check out this #EVJournalClub paper @natBME https://bit.ly/2SxNNoi with Michael Paulatis @HopkinsMedNews: Wed April 6, 12 noon (GMT-4) to join, see your email invitation or sign up at https://www.surveymonkey.com/r/L25KDWB",7
2020-05-04 17:13:16+00:00,We have been awarded with a project of the Instituto Salud Carlos III to develop a mRNA vaccine against #COVID19 We are overwhelmed by the trust of @SaludISCIII in our technology. We will give back hard work and strong dedication @ciqususc @TraffikGene,14
2020-05-05 10:31:50+00:00,"“It’s obvious that many people make a very adequate immune response” to the SARS-CoV-2 virus, and the animal trials so far show that modest doses of the mRNA vaccine for coronavirus have also generated a strong immune response.” ",9
2020-05-05 11:42:40+00:00,$ADVM +22% OPTIC data $AKBA +21% INNO2VATE data $BNTX +6% Initiating mRNA vaccine trial in humans $KPTI -7% On earnings $PTLA +131% Buyout ($18/sh) $TGTX +40% UNITY-CLL met primary,18
2020-05-05 11:44:49+00:00,Just in- Pfizer and BioNTech announce that the co's have administered the first dose of their vaccine in U.S. as part of global COVID-19 mRNA vaccine development program. First participants at NYU Grossman School of Medicine and University of Maryland School of Medicine,22
2020-05-05 11:46:16+00:00,This is a supercool paper! https://www.biorxiv.org/content/10.1101/2020.04.19.049254v2.full.pdf Conclusive that ACE2 mRNA is present in substantial number AT2 cells. Goes down with smoking but increases with age. Is it sufficient to cause ARDS? Maybe. Co-factors still likely important Kudos 2 all contributors #HugeEffort,8
2020-05-05 12:28:38+00:00,"My #COVID19 plays are : $MRNA : fast mRNA vaccine , FDA appr. soon $GILD: #Remdesivir THE antiviral $ABT &amp; $DGX : antibody test $LMNX : panel gene testing for hospitals $TDOC &amp; $ZM : contactless comm $ROKU &amp; $ATVI : home entertainment Much of it is priced, buy during dips",12
2020-05-05 15:19:37+00:00,mRNA-1273 - This vaccine uses parts of the coronavirus' genetic material to generate an immune response from the body. #COVID19vaccine,31
2020-05-05 16:43:08+00:00,The vaccine Pfizer is starting human trials of in US is an mRNA vaccine. It gets cells to make one of the coronavirus' proteins so that person's immune system can learn to recognize it. You can learn more about how it &amp; other vaccine contenders work here: https://bit.ly/coronavirusvaccinetypes,7
2020-05-05 19:25:15+00:00,Interesting comments by @NIAIDNews Director Fauci on the mRNA vaccines from $MRNA and Oxford University's @JennerInstitute in @NatGeo: https://www.nationalgeographic.com/science/2020/05/anthony-fauci-no-scientific-evidence-the-coronavirus-was-made-in-a-chinese-lab-cvd/#close,7
2020-05-05 19:46:25+00:00,"G@tes & F@uci push M0derna's MRNA vaccines, a form of genetic engineering M0derna plugs a small piece of genetic code into human cells, altering DNA throughout the human body &amp; reprogramming our cells that will turn mankind into GMO humans. Go to Hell ",55
2020-05-05 21:19:50+00:00,The first US patients have been dosed in a clinical trial testing whether four experimental mRNA vaccine candidates can prevent infection with the virus that causes #COVID19. Read more below. (@nyugrossman),8
2020-05-05 22:27:33+00:00,"The study vaccines are called “mRNA vaccines”. If successful, they can quickly be computer-designed and made available for millions of people using high-speed machines. They also have low risk of infection and immune challenges that come with older vaccines based on live virus.",51
2020-05-06 00:02:59+00:00,Something that’s hopeful about the vaccines being developed: Both Moderna vaccine+Pfizer vaccine being developed use mRNA to vaccine (first of its kind)!instead of a deactivated virus.This makes the manufacturing of the vaccine much faster and much cheaper ,12
2020-05-06 03:28:32+00:00,"DARPA was behind the creation of DNA and RNA vaccines, funding early R&D by Moderna Inc. (NASDAQ:MRNA) and Inovio Pharmaceuticals Inc. (NASDAQ:INO) at a time when the technologies were considered speculative by many scientists and investors. ",124
2020-05-06 04:45:01+00:00,"For those already infected with retroviruses, the mRNA containing coronavirus vaccine can theoretically reverse transcribe the spike protein back into your own DNA. WI-38 fetal cell line are contaminated with fragments of the human endogenous retrovirus HERV-K.",31
2020-05-06 08:20:00+00:00,Naturally-occurring cholesterol analogues in lipid nanoparticles induce polymorphic shape and enhance intracellular delivery of mRNA https://buff.ly/2zcVdGE (@NatureComms),5
2020-05-06 13:48:27+00:00,"Today at 1 pm I'll be doing a video chat with Tal Zaks, the chief medical officer of $MRNA, about the company's efforts at developing a #COVID19 vaccine.",14
2020-05-07 11:10:11+00:00,"$MRNA PR says that their COVID vaccine P3 trial could start ""early summer."" ",9
2020-05-07 11:15:49+00:00,$MRNA CFO leaving in August. Anyone notice the list of people no longer working alongside Stéphane Bancel is really long?,10
2020-05-07 11:33:13+00:00,"FDA gives green light to Moderna for Phase 2 study on its coronavirus vaccine. Co expects to start imminently, with goal of a Phase 3 study to begin in early summer, and approval as soon as 2021. $MRNA ",16
2020-05-07 11:59:37+00:00,$MRNA △ 15% pre-market. FDA approves its coronavirus vaccine for phase 2 trial. ,17
2020-05-07 12:04:44+00:00,"$MRNA surges, after news the FDA approved Moderna's coronavirus vaccine candidate for phase 2 study. ",32
2020-05-07 12:19:53+00:00,"Accelerated research & development timeline of our novel coronavirus (SARS-CoV-2 or COVID-19) #vaccine candidate, mRNA-1273. Read more: https://buff.ly/35GiJrV #mRNA ",69
2020-05-07 12:24:10+00:00,Our #CMV Phase 2 dose confirmation study is fully enrolled &amp; the first Phase 2 interim analysis is expected in the third quarter of 2020. #mRNA #StopCMV https://buff.ly/35GiJrV,48
2020-05-07 12:28:23+00:00,Covid-19 roundup: Moderna adds vaccine experts to the top team as PhIII trial looms — and the CFO hits the exit $MRNA ,6
2020-05-07 12:35:20+00:00,We are excited by the opportunity to bring forward a new class of medicines for patients. Thank you to the entire team of Moderna employees working hard every day to make our vision a reality. #mRNA ,20
2020-05-07 12:56:41+00:00,"Quick Rundown on Moderna, RNA & mRNA Vaccines: What Are They &amp; Why Should You Care? Bill Gates, along with Moderna’s mRNA-1273 COVID-19 vaccine trials will not solve our current ""pandemic"". Here's why. via @KenningtonPress",359
2020-05-07 14:09:04+00:00,$MRNA apr 17 conf call: 'our plan is STILL to start the phase 2 study in the US in the Q2 timeframe' vs today's headlines/stories.. rinse and repeat ,5
2020-05-07 19:12:41+00:00,"Yes unacceptable. M0derna (G@tes invests in) has signed a deal to manufacture 1 billion doses of mRNA-1273 per year. mRNA is highly controversial experimental nanotechnology that will edit human DNA. This is a crime, don't need it https://www.bitchute.com/video/uhuRTXVE2zq8/",79
2020-05-07 20:34:47+00:00,"Shouldn’t we assume $MRNA will be required to give away its coronavirus vaccine? (Assuming it works, which is a HUGE assumption.) Given govt $handouts Moderna has taken, seems no way they’ll be allowed to price the vaccine for profit. WAY worse than $GILD",8
2020-05-07 21:56:50+00:00,The RNA vaccine era finna be upon us. New COVID-19 using mRNA strains that code for specific antigens. This approach interesting. I rotated in a lab that was laying foundation for a different RNA based potential vaccine approach.,3
2020-05-07 22:41:29+00:00,COVID19 infection seems to impair men’s reproductive function and testosterone levels. Testes have the highest expression levels of ACE2 protein and mRNA in the body. Effect of SARS-CoV-2 infection upon male gonadal function: A single center-based study. ,17
2020-05-07 22:57:16+00:00,"Ahead of one of the most-watched jobs reports ever, we're covering you on every market angle on tomorrow's huge show, with $UBER CEO @dkhos, $MRNA CEO Stephane Bancel, Lazard's @porszag, plus our jobs panel of Kate Moore, @Austan_Goolsbee, Glenn Hubbard and Prof. Jeremy Siegel.",6
2020-05-08 00:56:11+00:00,"OPEN POSITION at the Reproductive and Developmental Biology Laboratory (http://www.redbiolab.unimi.it) of University of Milan. We are looking for a motivated and passionate student to carry out a PhD project #MSCA #ITN ""Somatic signals regulating mRNA translation in mammalian oocytes"" ",17
2020-05-08 03:00:05+00:00,"Moderna's mRNA platform could quickly handle any #SARSCoV2 mutations that arise, CEO Bancel told BioCentury. The co was cleared to start a Phase II trial of its #COVID19 vaccine, with a Phase III study planned for summer $MRNA ",6
2020-05-08 04:06:09+00:00,Big: FDA approves Moderna mRNA-based coronavirus vaccine's next phase in clinical trial ,63
2020-05-08 13:12:29+00:00,"“Moderna’s vaccine candidate, called mRNA-1273, relies on genetic material known as messenger RNA...The vaccine is written with a very specific recipe — in this case for making the spike protein of the coronavirus.” ",8
2020-05-08 14:02:12+00:00, mRNA #vaccines are a unique #technology and can be produced more rapidly than conventional vaccines. Learn more about how Pfizer is developing a potential mRNA vaccine to help prevent #COVID19. pic.twitter.com/wr9Sf34aTv,67
2020-05-08 22:43:36+00:00,"Moderna CEO Stéphane Bancel has secured huge grants on the promise of a new class of mRNA vaccines, but nobody really knows if they will work http://on.forbes.com/60141CMIu",11
2020-05-09 00:13:55+00:00,"In early March, Moderna’s mRNA vaccine, which represents an entirely new way to provide immunity to disease, was injected into humans for the first time http://on.forbes.com/60131CML3",36
2020-05-09 03:00:00+00:00,"#COVID19 Latest rankings in the vaccine race from @WIRED Phase 2: Oxford / $AZN, $MRNA, $CASBF Phase 1: $BNTX / $PFE, $INO",5
2020-05-09 11:57:30+00:00,A NEW GENERATION OF UNTESTED EXPERIMENTAL VACCINES ARE NOW READY mRNA VACCINES WILL CHANGE YOUR DNA JUST IN TIME FOR THE COVID-19 PANDEMIC BILL GATES AND THE NIH WANT TO VAX THE WORLD WITH THEIR NEW mRNA VACCINES THAT ACTUALLY CHANGES THE PATIENTS DNA ,16
2020-05-09 12:49:28+00:00,"What do Bill Gates, Moderna & mRNA vaccines all have in common? ",13
2020-05-09 14:06:18+00:00,"Our therapeutic and vaccination strategy should be 1) remdesivir, and new combos like Kaletra+ribavirin+interferon. 2) as many doses as we can make of mRNA and antibodies in the fall for high risk populations to ring fence. 3) vaccines in late Q4/Q1.",4
2020-05-09 14:54:32+00:00,Transcription Dynamics Regulate Poly(A) Tails and Expression of the RNA Degradation Machinery to Balance mRNA Levels ,22
